{
  "name": "status: status 503: TECHNICAL",
  "recipe": "axis.precheck.status",
  "input": {
    "loanRequestId": "LR-GOLDEN-1"
  },
  "mocks": {
    "precheck.findByLoanRequest@1": {
      "result": {
        "loanRequestId": "LR-GOLDEN-1",
        "customerId": "CUST-TEST-1",
        "applicantId": "APP-TEST-9",
        "clientLoanId": "d0964d53-e978-5ab5-a2d7-dc7ec85e5dc4",
        "responseMap": {
          "timble": {
            "status": "SUCCESS",
            "statusMessage": "Timble Precheck Successful"
          }
        }
      }
    },
    "axis.precheck.status@1": {
      "resp": {
        "status": 503
      }
    }
  },
  "expect": {
    "failure": "L1_TECHNICAL"
  }
}
