{
  "name": "notify verified: 503 is retried",
  "recipe": "precheck.notify.verified",
  "input": {
    "loanRequestId": "LR-GOLDEN-1"
  },
  "mocks": {
    "rupeekweb.precheck.verification@1": {
      "resp": {
        "status": 503
      }
    }
  },
  "expect": {
    "failure": "L1_TECHNICAL"
  }
}
