{
  "name": "timble: same attempt already has a reference (Temporal retry): no lender call",
  "recipe": "axis.precheck.timble",
  "input": {
    "loanRequestId": "LR-GOLDEN-1",
    "runNo": 1,
    "loanProcess": "fresh"
  },
  "mocks": {
    "core.fetchCustomerByLoanRequest@1": {
      "resp": {
        "status": 200,
        "body": {
          "UserMsg": "SUCCESS",
          "loandata": [
            {
              "customer": {
                "id": "CUST-TEST-1",
                "firstName": "Ravi",
                "lastName": "Sharma",
                "customerProofName": "Ravi Kumar Sharma",
                "customerPanName": "RAVI KUMAR SHARMA",
                "customerPhone": "9000000001",
                "email": "ravi.test@example.com",
                "gender": "M",
                "dob": "1990-01-05",
                "aadhar": "000011112222",
                "pan": "ABCDE1234F",
                "customerAddress": "  12,  MG Road   Bengaluru ",
                "permanentAddress": {
                  "city": "Bengaluru",
                  "state": "Karnataka",
                  "pin": "560001"
                },
                "presentAddress": {
                  "city": "Mysuru",
                  "state": "Karnataka",
                  "pin": "570001"
                }
              }
            }
          ]
        }
      }
    },
    "precheck.findByLoanRequest@1": {
      "result": {
        "loanRequestId": "LR-GOLDEN-1",
        "clientLoanId": "d0964d53-e978-5ab5-a2d7-dc7ec85e5dc4",
        "applicantId": "A",
        "reference_id": "TIMBLE-OLD"
      }
    }
  },
  "expect": {
    "outcome": "ALREADY_INITIATED",
    "out": {
      "timbleReferenceId": "TIMBLE-OLD"
    },
    "notCalled": [
      "axis.precheck.timble@1",
      "precheck.audit.insert@1"
    ]
  }
}
