{
  "name": "dedupe: fresh customer, dedupe accepted",
  "recipe": "axis.precheck.dedupe",
  "input": {
    "loanRequestId": "LR-GOLDEN-1",
    "runNo": 1,
    "loanProcess": "fresh"
  },
  "mocks": {
    "core.fetchCustomerByLoanRequest@1": {
      "resp": {
        "status": 200,
        "body": {
          "UserMsg": "SUCCESS",
          "loandata": [
            {
              "customer": {
                "id": "CUST-TEST-1",
                "firstName": "Ravi",
                "lastName": "Sharma",
                "customerProofName": "Ravi Kumar Sharma",
                "customerPanName": "RAVI KUMAR SHARMA",
                "customerPhone": "9000000001",
                "email": "ravi.test@example.com",
                "gender": "M",
                "dob": "1990-01-05",
                "aadhar": "000011112222",
                "pan": "ABCDE1234F",
                "customerAddress": "  12,  MG Road   Bengaluru ",
                "permanentAddress": {
                  "city": "Bengaluru",
                  "state": "Karnataka",
                  "pin": "560001"
                },
                "presentAddress": {
                  "city": "Mysuru",
                  "state": "Karnataka",
                  "pin": "570001"
                }
              }
            }
          ]
        }
      }
    },
    "axis.precheck.invoke@1": {
      "resp": {
        "status": 200,
        "body": {
          "data": {
            "applicantId": "APP-TEST-9",
            "consumerLoanApplicationRefId": "REF-TEST-9",
            "onBoardingInProgress": "N"
          },
          "code": "200",
          "message": "ok"
        }
      }
    }
  },
  "expect": {
    "outcome": "INITIATED",
    "out": {
      "applicantId": "APP-TEST-9",
      "clientLoanId": "d0964d53-e978-5ab5-a2d7-dc7ec85e5dc4"
    },
    "calls": {
      "axis.precheck.invoke@1": {
        "params.type": "dedupe",
        "params.body.client_loan_id": "d0964d53-e978-5ab5-a2d7-dc7ec85e5dc4",
        "params.body.customer_id": "CUST-TEST-1",
        "params.body.application_id": null,
        "params.body.first_name": "RAVI",
        "params.body.middle_name": "KUMAR",
        "params.body.last_name": "SHARMA",
        "params.body.address[0].address_value": "12, MG Road Bengaluru",
        "params.body.address[1].address_city": "Mysuru"
      },
      "axis.precheck.saveDedupe@1": {
        "params.applicantId": "APP-TEST-9",
        "params.clientLoanId": "d0964d53-e978-5ab5-a2d7-dc7ec85e5dc4",
        "params.customerId": "CUST-TEST-1"
      }
    },
    "notCalled": [
      "axis.precheck.saveDedupeRerun@1",
      "precheck.audit.insert@1"
    ]
  }
}
