{
  "name": "dedupe: Axis 503: TECHNICAL, retried by L2",
  "recipe": "axis.precheck.dedupe",
  "input": {
    "loanRequestId": "LR-GOLDEN-1",
    "runNo": 1,
    "loanProcess": "fresh"
  },
  "mocks": {
    "core.fetchCustomerByLoanRequest@1": {
      "resp": {
        "status": 200,
        "body": {
          "UserMsg": "SUCCESS",
          "loandata": [
            {
              "customer": {
                "id": "CUST-TEST-1",
                "firstName": "Ravi",
                "lastName": "Sharma",
                "customerProofName": "Ravi Kumar Sharma",
                "customerPanName": "RAVI KUMAR SHARMA",
                "customerPhone": "9000000001",
                "email": "ravi.test@example.com",
                "gender": "M",
                "dob": "1990-01-05",
                "aadhar": "000011112222",
                "pan": "ABCDE1234F",
                "customerAddress": "  12,  MG Road   Bengaluru ",
                "permanentAddress": {
                  "city": "Bengaluru",
                  "state": "Karnataka",
                  "pin": "560001"
                },
                "presentAddress": {
                  "city": "Mysuru",
                  "state": "Karnataka",
                  "pin": "570001"
                }
              }
            }
          ]
        }
      }
    },
    "axis.precheck.invoke@1": {
      "resp": {
        "status": 503,
        "body": null
      }
    }
  },
  "expect": {
    "failure": "L1_TECHNICAL"
  }
}
