{
  "name": "status: one flag N: FAILURE with the legacy JSON detail",
  "recipe": "axis.precheck.status",
  "input": {
    "loanRequestId": "LR-GOLDEN-1"
  },
  "mocks": {
    "precheck.findByLoanRequest@1": {
      "result": {
        "loanRequestId": "LR-GOLDEN-1",
        "customerId": "CUST-TEST-1",
        "applicantId": "APP-TEST-9",
        "clientLoanId": "d0964d53-e978-5ab5-a2d7-dc7ec85e5dc4",
        "responseMap": {
          "timble": {
            "status": "SUCCESS",
            "statusMessage": "Timble Precheck Successful"
          }
        }
      }
    },
    "axis.precheck.status@1": {
      "resp": {
        "status": 200,
        "body": {
          "dedupe": "Y",
          "pan": "N",
          "ramp": "Y",
          "hunter": "Y"
        }
      }
    }
  },
  "expect": {
    "outcome": "FAILURE",
    "out": {
      "pan": "N"
    },
    "calls": {
      "axis.precheck.saveStatusFinal@1": {
        "params.approved": false,
        "params.overall.status": "FAILURE",
        "params.overall.statusMessage": "Precheck failure received from lender services : {\"customerAcceptanceStatus\":null,\"customerBlacklistStatus\":null,\"axisPreCheckStatus\":null,\"dedupe\":{\"status\":\"SUCCESS\",\"statusMessage\":\"\"},\"pan\":{\"status\":\"FAILURE\",\"statusMessage\":\"\"},\"ramp\":{\"status\":\"SUCCESS\",\"statusMessage\":\"\"},\"hunter\":{\"status\":\"SUCCESS\",\"statusMessage\":\"\"},\"timble\":{\"status\":\"SUCCESS\",\"statusMessage\":\"Timble Precheck Successful\"}}"
      },
      "precheck.audit.recordOutcome@1": {
        "params.status": "failure"
      }
    }
  }
}
