{
  "name": "dedupe: another attempt is still in progress: skipped like lendercore, skip audited",
  "recipe": "axis.precheck.dedupe",
  "input": {
    "loanRequestId": "LR-GOLDEN-1",
    "runNo": 1,
    "loanProcess": "fresh"
  },
  "mocks": {
    "core.fetchCustomerByLoanRequest@1": {
      "resp": {
        "status": 200,
        "body": {
          "UserMsg": "SUCCESS",
          "loandata": [
            {
              "customer": {
                "id": "CUST-TEST-1",
                "firstName": "Ravi",
                "lastName": "Sharma",
                "customerProofName": "Ravi Kumar Sharma",
                "customerPanName": "RAVI KUMAR SHARMA",
                "customerPhone": "9000000001",
                "email": "ravi.test@example.com",
                "gender": "M",
                "dob": "1990-01-05",
                "aadhar": "000011112222",
                "pan": "ABCDE1234F",
                "customerAddress": "  12,  MG Road   Bengaluru ",
                "permanentAddress": {
                  "city": "Bengaluru",
                  "state": "Karnataka",
                  "pin": "560001"
                },
                "presentAddress": {
                  "city": "Mysuru",
                  "state": "Karnataka",
                  "pin": "570001"
                }
              }
            }
          ]
        }
      }
    },
    "precheck.findByLoanRequest@1": {
      "result": {
        "loanRequestId": "LR-GOLDEN-1",
        "clientLoanId": "legacy-random-id",
        "responseMap": {}
      }
    }
  },
  "expect": {
    "outcome": "IN_PROGRESS",
    "notCalled": [
      "axis.precheck.invoke@1"
    ],
    "calls": {
      "precheck.audit.insert@1": {
        "params.status": "skip",
        "params.loanProcess": "fresh",
        "params.remarks": "API call skipped - Axis precheck already initiated and not yet completed"
      }
    }
  }
}
